#,Subreddit,Submission,Comment,Timestamp(PT),Comment Score,Number of Comments in Submission,Perpective Score
1,•ÈÀpolitics,/r/politics/comments/84ah56/pennsylvania_vote_shows_that_trumpism_has_its/,"As a reminder, this subreddit [is for civil discussion.](/r/politics/wiki/index#wiki_be_civil)In general, be courteous to others. Attack ideas, not users. Personal insults, shill or troll accusations, hate speech, and other incivility violations can result in a permanent ban. If you see comments in violation of our rules, please report them.****I am a bot, and this action was performed automatically. Please [contact the moderators of this subreddit](/message/compose/?to=/r/politics) if you have any questions or concerns.*",3/13/18 20:58,1,1,0.3889421
2,•ÈÀpolitics,/r/politics/comments/84ah4r/lamb_wins_pennsylvania_special_election_18th/,"As a reminder, this subreddit [is for civil discussion.](/r/politics/wiki/index#wiki_be_civil)In general, be courteous to others. Attack ideas, not users. Personal insults, shill or troll accusations, hate speech, and other incivility violations can result in a permanent ban. If you see comments in violation of our rules, please report them.****I am a bot, and this action was performed automatically. Please [contact the moderators of this subreddit](/message/compose/?to=/r/politics) if you have any questions or concerns.*",3/13/18 20:58,1,1,0.3889421
3,•ÈÀpolitics,/r/politics/comments/84ah1t/dreaming_of_an_empty_seat/,"As a reminder, this subreddit [is for civil discussion.](/r/politics/wiki/index#wiki_be_civil)In general, be courteous to others. Attack ideas, not users. Personal insults, shill or troll accusations, hate speech, and other incivility violations can result in a permanent ban. If you see comments in violation of our rules, please report them.****I am a bot, and this action was performed automatically. Please [contact the moderators of this subreddit](/message/compose/?to=/r/politics) if you have any questions or concerns.*",3/13/18 20:58,1,1,0.3889421
4,•ÈÀpolitics,/r/politics/comments/84agkz/dccc_declares_victory_in_pennsylvania_special/,"As a reminder, this subreddit [is for civil discussion.](/r/politics/wiki/index#wiki_be_civil)In general, be courteous to others. Attack ideas, not users. Personal insults, shill or troll accusations, hate speech, and other incivility violations can result in a permanent ban. If you see comments in violation of our rules, please report them.****I am a bot, and this action was performed automatically. Please [contact the moderators of this subreddit](/message/compose/?to=/r/politics) if you have any questions or concerns.*",3/13/18 20:55,1,3,0.3889421
5,•ÈÀpolitics,/r/politics/comments/84agkz/dccc_declares_victory_in_pennsylvania_special/,Democrats don't run sacrificial Lambs anymore.,3/13/18 20:56,1,3,0.30576238
6,•ÈÀpolitics,/r/politics/comments/84agkz/dccc_declares_victory_in_pennsylvania_special/,"It's theoretically too close to call, but it represents a win for the Democrats even if it's this close--and the absentee ballots are likely going to help lamb. ",3/13/18 20:58,1,3,0.0660821
7,•ÈÀpolitics,/r/politics/comments/84afrt/3_illinois_men_including_one_who_drafted_a_border/,"As a reminder, this subreddit [is for civil discussion.](/r/politics/wiki/index#wiki_be_civil)In general, be courteous to others. Attack ideas, not users. Personal insults, shill or troll accusations, hate speech, and other incivility violations can result in a permanent ban. If you see comments in violation of our rules, please report them.****I am a bot, and this action was performed automatically. Please [contact the moderators of this subreddit](/message/compose/?to=/r/politics) if you have any questions or concerns.*",3/13/18 20:52,1,7,0.3889421
8,•ÈÀpolitics,/r/politics/comments/84afrt/3_illinois_men_including_one_who_drafted_a_border/,Trump's base. ,3/13/18 20:52,1,7,0.027551569
9,•ÈÀpolitics,/r/politics/comments/84afrt/3_illinois_men_including_one_who_drafted_a_border/,"Good, three less bad people in minnesota when I move there this fall",3/13/18 20:55,1,7,0.26145494
10,•ÈÀpolitics,/r/politics/comments/84afrt/3_illinois_men_including_one_who_drafted_a_border/,"I really like Trump. What he has done. Not the least of which was defeating Hillary.Will that be on my headstone?Here lies a bastard who supported Trump.",3/13/18 20:57,1,7,0.815847
11,•ÈÀpolitics,/r/politics/comments/84afrt/3_illinois_men_including_one_who_drafted_a_border/,From South Dakota to Minnesota...that's going to be an incredible cultural change for you.,3/13/18 20:56,1,7,0.05737917
#,Subreddit,Submission,Comment,Timestamp(PT),Comment Score,Number of Comments in Submission,Perpective Score
1,•ÈÀpolitics,/r/politics/comments/84ah56/pennsylvania_vote_shows_that_trumpism_has_its/,"As a reminder, this subreddit [is for civil discussion.](/r/politics/wiki/index#wiki_be_civil)In general, be courteous to others. Attack ideas, not users. Personal insults, shill or troll accusations, hate speech, and other incivility violations can result in a permanent ban. If you see comments in violation of our rules, please report them.****I am a bot, and this action was performed automatically. Please [contact the moderators of this subreddit](/message/compose/?to=/r/politics) if you have any questions or concerns.*",3/13/18 20:58,1,1,0.3889421
2,•ÈÀpolitics,/r/politics/comments/84ah4r/lamb_wins_pennsylvania_special_election_18th/,"As a reminder, this subreddit [is for civil discussion.](/r/politics/wiki/index#wiki_be_civil)In general, be courteous to others. Attack ideas, not users. Personal insults, shill or troll accusations, hate speech, and other incivility violations can result in a permanent ban. If you see comments in violation of our rules, please report them.****I am a bot, and this action was performed automatically. Please [contact the moderators of this subreddit](/message/compose/?to=/r/politics) if you have any questions or concerns.*",3/13/18 20:58,1,1,0.3889421
1,worldnews,/r/worldnews/comments/84ah7n/stephen_hawking_dies_at_age_76/,Fuck,3/13/18 20:59,1,2,0.9727154
2,worldnews,/r/worldnews/comments/84ah40/physicist_stephen_hawking_dies_aged_76/,It's frankly really amazing he lived as long as he did. ,3/13/18 20:59,1,2,0.05935775
1,movies,/r/movies/comments/84adrv/fantastic_movie_what_movie_is_this_snakes_on_plane/,"snakes, checkplane, checksamuel l jackson, checkyes its snakes on a plane",3/13/18 20:50,1,1,0.10310979
2,movies,/r/movies/comments/84a9qx/madonna_to_direct_ballerina_drama_taking_flight/,"Oh, FFS.If there was ever a pop star that overstayed  her welcome it‰Ûªs her.",3/13/18 20:24,0,1,0.4580935
1,music,/r/Music/comments/84adle/jai_paul_btstu_electronicalternative_2013/,"**Jai Paul**   [artist pic](https://lastfm-img2.akamaized.net/i/u/252/8294f4b08327427d980358d52727f240.png)  > Jai Paul is a British songwriter and record producer from Rayners Lane, United Kingdom. He is signed to XL Recordings.> Paul's 2007 demo ""BTSTU"" received widespread blog coverage throughout 2010, and has been played on UK national radio by DJs including Gilles Peterson, Zane Lowe, Nick Grimshaw, Reggie Yates and Fearne Cotton.> In December 2010, Paul was longlisted for the BBC Sound of 2011 poll.> ""BTSTU (Edit)"" was playlisted on BBC Radio 1 following its release as a digital download on April 21, 2011, via XL. The single received favourable reviews, and was made 'Hottest Record in the World' on Zane Lowe's BBC Radio 1 show.> On May 20, 2011, Canadian hip hop artist Drake leaked a track titled ""Dreams Money Can Buy"" via his blog. Shortly afterward, ""Till The End Of Time"", a song by American R&B artist BeyoncÌ© surfaced online. Both tracks feature a sample of Paul's ""BTSTU"" demo. On August 30, 2011, ""BTSTU (Edit)"" was included on Radio Nova's ""Nova Tunes 2.4"" compilation in France, and on October 25 of the same year the track appeared on ""Annie Mac Presents 2011"" in the UK (listed as ""BTSU"").> On March 30, 2012, Jai Paul uploaded a new demo titled ""Jasmine (Demo)"" to his SoundCloud page. The demo was given an official release via XL on April 9, 2012. Pitchfork named it ‰ÛÏBest New Track‰Û within an hour of its appearance on Paul‰Ûªs Soundcloud page, where it clocked over 500,000 plays within a month. On April 2, ""Jasmine (Demo)"" was played on BBC Radio One by Zane Lowe, who chose it as his Next Hype Track. On April 9, Annie Mac named it her Record of the Week. ""Jasmine (Demo)"" received universal critical acclaim in the media, with The New York Times praising its ‰ÛÏPrince era sensuality‰Û and The Guardian simply describing the production as ‰ÛÏamazing.‰Û> There has been media speculation about Paul's background and motivation, as he has remained out of the public eye. The British publication Clash commented on Jai‰Ûªs mysteriousness, saying ‰ÛÏHype is a fascinating commodity. Where some quickly melt down the attention for liquid purpose, promising talent Jai Paul removed all his music from MySpace and went to get his shit together‰Û. XL Recordings founder and owner Richard Russell acknowledged Paul's unpredictability, saying, ""Jai is a wizard...the way he's going about things is, I think for many, baffling. But...he's going about things in the most Jai Paul way you could possibly go about things. And who knows where that may lead.""> >  Read more on Last.fm. [last.fm](https://www.last.fm/music/Jai+Paul): 253,096 listeners, 3,073,150 plays   tags: *experimental, electronic, wonky, electronica, hip hop*  ^^Please ^^downvote ^^if ^^incorrect!  ^^Self-deletes ^^if ^^score ^^is ^^0.",3/13/18 20:43,1,2,0.19720462
2,music,/r/Music/comments/84adle/jai_paul_btstu_electronicalternative_2013/,I just realized how wrong I was on the year it‰Ûªs 2007.,3/13/18 20:44,1,2,0.07273454
1,The_Donald,/r/The_Donald/comments/84ah75/physicist_stephen_hawking_dies_aged_76/,RIP ,3/13/18 20:59,1,1,0.20772655
2,The_Donald,/r/The_Donald/comments/84agd3/why_do_we_keep_fucking_this_up_why_arent_we_voting/,"It's not that complex.  The area just had a corrupt R get the boot.It's astonishing that it is even this close.  Also, if it stays this close, this drags out.",3/13/18 20:56,2,4,0.3889421
3,The_Donald,/r/The_Donald/comments/84agd3/why_do_we_keep_fucking_this_up_why_arent_we_voting/,"Well, you'd have to ask Pennsylvania citizens. Ya know what I think it is? Many trump voters don't like a lot of republicans, and dislike most democrats. As a huge trump supporter, I would say I'm not a fan of some of the most powerful and prominent republicans in modern America. So I think that's our issue. ",3/13/18 20:56,2,4,0.1639746
4,The_Donald,/r/The_Donald/comments/84agd3/why_do_we_keep_fucking_this_up_why_arent_we_voting/,I forgot to vote and I didn't like the Republican candidate,3/13/18 20:55,1,4,0.12329451
1,gaming,/r/gaming/comments/84afyq/a_friendly_reminder/,Overwatch ? ,3/13/18 20:55,1,3,0.015999492
2,gaming,/r/gaming/comments/84afyq/a_friendly_reminder/,"Or rather... ""If the game isn't fucking TDM, K/D doesn't matter.""",3/13/18 20:57,1,3,0.9426893
3,gaming,/r/gaming/comments/84afyq/a_friendly_reminder/,Rainbow 6 mostly but the point is broad. ,3/13/18 20:59,1,3,0.026450314
1,news,/r/news/comments/84agwl/physicist_stephen_hawking_dies_aged_76/,What an absolute legend. RIP,3/13/18 20:59,1,3,0.11901725
2,news,/r/news/comments/84agwl/physicist_stephen_hawking_dies_aged_76/,"A sad day.A small thing relatively (hah?), but I can't help but think our kids and theirs will use ""Hawking"" like we used ""Einstein"" - in jest and in respect.Insert witty salute here.",3/13/18 20:59,1,3,0.096067175
1,nfl,/r/nfl/comments/84ag10/jamal_adams_to_teddy_bridgewater_on_twitter/,So...it is official?,3/13/18 20:54,5,10,0.017545637
2,nfl,/r/nfl/comments/84ag10/jamal_adams_to_teddy_bridgewater_on_twitter/,Jamal Adams seems like a nice guy,3/13/18 20:57,4,10,0.037298914
3,nfl,/r/nfl/comments/84ag10/jamal_adams_to_teddy_bridgewater_on_twitter/,teddy wins the starting job in camp ,3/13/18 20:57,3,10,0.12692174
4,nfl,/r/nfl/comments/84ag10/jamal_adams_to_teddy_bridgewater_on_twitter/,Jets getting Teddy may be the deal of the offseason if he's able to play starting caliber football again.,3/13/18 20:57,2,10,0.058514316
5,nfl,/r/nfl/comments/84ag10/jamal_adams_to_teddy_bridgewater_on_twitter/,Yeah one year 5mil. I‰Ûªm biased but that‰Ûªs a fucking steal if Bradford is getting 20mil.,3/13/18 20:56,7,10,0.9198804
6,nfl,/r/nfl/comments/84ag10/jamal_adams_to_teddy_bridgewater_on_twitter/,Link? I didn‰Ûªt see this on the feed.,3/13/18 20:58,2,10,0.036875073
7,nfl,/r/nfl/comments/84ag10/jamal_adams_to_teddy_bridgewater_on_twitter/,He‰Ûªs getting paid to be a backup though right?,3/13/18 20:57,1,10,0.11605266
8,nfl,/r/nfl/comments/84ag10/jamal_adams_to_teddy_bridgewater_on_twitter/,Bias but true if knee holds up ,3/13/18 20:57,1,10,0.11876112
9,nfl,/r/nfl/comments/84ag10/jamal_adams_to_teddy_bridgewater_on_twitter/,Fucking Kirk Cousins.  Super not happy about that lmao ,3/13/18 20:58,1,10,0.95831543
10,nfl,/r/nfl/comments/84ag10/jamal_adams_to_teddy_bridgewater_on_twitter/,"yeah, you're biased",3/13/18 20:57,-1,10,0.3011243
1,leagueoflegends,/r/leagueoflegends/comments/84afp0/my_very_first_blind_dragon_steal/,"[YouTube mirror](https://www.youtube.com/watch?v=Rup7rIpNsVI)***boop beep.Can someone introduce me to Orianna? I have a crush on The Ball!",3/13/18 20:52,1,1,0.5594742
2,leagueoflegends,/r/leagueoflegends/comments/84ae18/player_threatens_to_shoot_up_a_school_after/,Standard Talon main ,3/13/18 20:51,1,3,0.016478587
3,leagueoflegends,/r/leagueoflegends/comments/84ae18/player_threatens_to_shoot_up_a_school_after/,"it's ok, the teacher will shotgun him in the face before he can do something#murica",3/13/18 20:45,1,3,0.7352219
4,leagueoflegends,/r/leagueoflegends/comments/84ae18/player_threatens_to_shoot_up_a_school_after/,Shit I thought we only needed those for bears.,3/13/18 20:57,1,3,0.92878497
1,BlackPeopleTwitter,/r/BlackPeopleTwitter/comments/84abqc/_/,Well it is the best way to record and splice audio for free.,3/13/18 20:49,1,1,0.047550548
2,BlackPeopleTwitter,/r/BlackPeopleTwitter/comments/84a8s0/when_your_employer_asks_if_you_have_a_twitter/,"What happened to that reddit account every one was allowed to use to give their wives the impression they were true decicated men? Did it spin off other community accounts?",3/13/18 20:43,1,1,0.1184654
1,Overwatch,/r/Overwatch/comments/84afdw/are_the_competitive_points_golden_guns_currently/,"I don't believe you get any points for losing. it's 5 for a draw, 15 for a win, and 0 for a loss",3/13/18 20:53,1,3,0.13322274
2,Overwatch,/r/Overwatch/comments/84afdw/are_the_competitive_points_golden_guns_currently/,"No CP reward for losing. Winning gives you 15 CP, drawing gives you 5 CP, and losing gives you 0 CP. Do you expect people reward you for mediocrity? ",3/13/18 20:53,1,3,0.46095464
3,Overwatch,/r/Overwatch/comments/84afdw/are_the_competitive_points_golden_guns_currently/,"I could have sworn that it used to give points for a loss after the rework in Season 2. Well, thanks for answering politely.",3/13/18 20:56,1,3,0.04162681
1,hearthstone,/r/hearthstone/comments/84agdg/kripp_vs_yogg/,How are you so fast??,3/13/18 20:55,1,3,0.05526685
2,hearthstone,/r/hearthstone/comments/84agdg/kripp_vs_yogg/,I laughed so god dam hard at that entire match. You really should do a recap of that match. ,3/13/18 20:59,1,3,0.30099252
3,hearthstone,/r/hearthstone/comments/84agdg/kripp_vs_yogg/,The moment opponent played Yogg was ready to clip BlessRNG,3/13/18 20:56,1,3,0.14517078
1,Games,/r/Games/comments/84a9py/tekken_7s_noctis_dlc_releases_next_week/,I need a good deal on this digitally for Xbox at some point. I wanna jump into the fighting genre and Tekken looks fun as hell. It‰Ûªs super fun in the arcade too. ,3/13/18 20:29,1,1,0.23754409
2,Games,/r/Games/comments/8491yu/what_are_some_open_world_games_that_would/,"Homefront: The Revolution, as the repetitive open world quests are just not interesting, while the linear DLCs are much more enjoyable than the main game itself, especially since the protagonist suddenly learns to speak.",3/13/18 17:30,1,37,0.051378824
3,Games,/r/Games/comments/8491yu/what_are_some_open_world_games_that_would/,"Mafia III jumps to mind. That game had a really cool story lined up and that hollow over-world kind of wrecks the flow of the game for me.  I know the series has some defenders for the open world portions.  I can‰Ûªt speak for the other entries, but III died for me because getting to the actual interesting bits involved way to much tedium to be worth it.",3/13/18 18:09,1,37,0.13399015
4,Games,/r/Games/comments/8491yu/what_are_some_open_world_games_that_would/,"NieR: Automata's open world only really served to muddy the waters on what was important and what wasn't. The fact that some side quests were important additions to the story and some were nearly-meaningless fetch quests, with no indication on what you were getting yourself into beforehand, only compounded the issue.",3/13/18 19:51,1,37,0.053629544
5,Games,/r/Games/comments/8491yu/what_are_some_open_world_games_that_would/,"I went through my open world list and I couldn't see one that I thought would be better if it wasn't open world. That doesn't mean they all have a good open world. It's more like the games would be better if their open world was done better rather than taking it out completely. I haven't played it myself, but from what I've seen and heard, Dynasty Warriors 9 seems like it has a terrible AND unnecessary open world.",3/13/18 17:40,1,37,0.1528206
6,Games,/r/Games/comments/8491yu/what_are_some_open_world_games_that_would/,"It's a bit of an odd opinion, but I thought MGSV was mostly a bunch of different levels all strung together with an open world. Nothing really happened on the places between major points, aside from some material gathering and the occasional checkpoint.",3/13/18 19:46,1,37,0.11568792
7,Games,/r/Games/comments/8491yu/what_are_some_open_world_games_that_would/,"Mirror's Edge Catalyst, the parkour and movement was much better but the open world was awful.  What was even the point of making it an open world?  The original was extremely linear and it was still a fun game.",3/13/18 20:18,1,37,0.09799655
8,Games,/r/Games/comments/8491yu/what_are_some_open_world_games_that_would/,"Assassin's Creed.But before anyone goes bonkers over that, I think Assassin's Creed specifically in regard to it's overarching narrative. AC as historical simulator is great as open world. AC as good storytelling about a modern day conspiracy and secret war using genetic memory would be better served as a linear experience, imo.",3/13/18 17:23,1,37,0.0911576
9,Games,/r/Games/comments/8491yu/what_are_some_open_world_games_that_would/,"2 hours and no ones mentioned L.A. Noire? i'm shocked.But yeah, pretty much pointless being open world other than it looked nice.",3/13/18 20:03,1,37,0.17927437
10,Games,/r/Games/comments/8491yu/what_are_some_open_world_games_that_would/,"Mass Effect: AndromedaThe open world zones just didn't work. They weren't used in interesting ways, filled with nothing more than fetch quests and they were just incredibly static environments to begin with, not even having day/night cycles - the hubs and small outposts were dead and didn't feel alive at all. They were essentially everything bad about modern open world design without any of the good.The one positive from them was that it opened up space for some fun combat opportunities but they could have easily achieved that my being a bit more open with ME's traditionally linear level design.",3/13/18 18:31,1,37,0.038959976
11,Games,/r/Games/comments/8491yu/what_are_some_open_world_games_that_would/,"Recore. Lovely game, aside from being unfinished. The open world felt like nothing. It was a large vasty world populated by...........nothing. Sand. Wreckage. Occasionally a robot. ",3/13/18 17:22,1,37,0.13369393
12,Games,/r/Games/comments/8491yu/what_are_some_open_world_games_that_would/,"The Division. They put painstaking effort into recreating New York City... and for what? So I can randomly encounter the same generic enemies anywhere I want in a real-to-life cityscape? I've heard people say the city feels ""alive"" because there's random civilians and dogs, but I can't understand. All the civilians ever do is complain about how bad everything is and sometimes ask you for consumables. And the dogs poop sometimes. Immersion, wow! But the reality is that unless you are absolutely in love with the setting and feel compelled to hunt down all the phones/flashbacks/etc., there's really just no good reason to actually roam around or explore.Seriously, all the different ""quest hubs"" could have just been, you know, regular levels. To connect them all together achieves... what? Pointless travel time? You spend the entire PvE endgame in instances anyway, doing the Division equivalent of MMO dungeons. The only part of the game where the open-world aspect seems to actually matter is the Dark Zone, and that's only because there's other players roaming around who are potential threats.",3/13/18 17:56,1,37,0.23754409
13,Games,/r/Games/comments/8491yu/what_are_some_open_world_games_that_would/,"Metal Gear Solid V. If the game was comprised of a series of conjoined areas, similar to the earlier games but bigger, I think would have been a much better game. The actual open world is mostly empty and not used for very much.  Very few missions make much use of it.  The best missions in the game take place in facilities, or a small town, or similar.  Cutting down the dead space around mission areas and focusing on gameplay from a few points of entry would enhance the experience of a lot of the missions.",3/13/18 18:42,1,37,0.030774862
14,Games,/r/Games/comments/8491yu/what_are_some_open_world_games_that_would/,No More Heroes is the obvious one. Especially with all the bullshit you have to do between the story missions.,3/13/18 18:26,1,37,0.8224779
15,Games,/r/Games/comments/8491yu/what_are_some_open_world_games_that_would/,"Tomb Raider reboots.  The open world aspects are just filled with content to grind.  I'd much rather it have levels like the old games with secrets to find and puzzles to solve within mostly open levels.Hell, the story would benefit massively from it, too.",3/13/18 18:31,1,37,0.1545014
16,Games,/r/Games/comments/8491yu/what_are_some_open_world_games_that_would/,"Mad Max, it's a great world, they got the vibe down perfectly, but the open world is kinda boring. If they'd taken the same world and made large corridor style levels with a tight story, I think it could've been quite the masterpiece.",3/13/18 19:44,1,37,0.25352743
17,Games,/r/Games/comments/8491yu/what_are_some_open_world_games_that_would/,[removed],3/13/18 19:05,1,37,0.11167378
18,Games,/r/Games/comments/8491yu/what_are_some_open_world_games_that_would/,"Basically all three Mafia games. In all three cases, they had both good world design and a solid story. Neither fit the other at all. Mafia 2 in particular had such good narrative momentum it made it tough to ever know whether it was okay to go exploring... or even want to.",3/13/18 20:24,1,37,0.097648114
19,Games,/r/Games/comments/8491yu/what_are_some_open_world_games_that_would/,"Just picked it up and started playing it, so haven't done much with it yet. I've heard it's fantastic apart from that though.",3/13/18 20:59,1,37,0.046713553
20,Games,/r/Games/comments/8491yu/what_are_some_open_world_games_that_would/,"I always kept thinking how much better the original Assassins Creed would be if each Assassination was just a level. You spawn in a designated area, do the stalking and the hiding, kill the target, run the fuck away, then the level ends and you move onto the next one.Imagine an AC1 with all the pointless open world BS removed.",3/13/18 18:21,1,37,0.8485217
21,Games,/r/Games/comments/8491yu/what_are_some_open_world_games_that_would/,Outside of a few missions where you had to find landmarks it was very useless also add onto that you could fast travel everywhere compounding it even more so.  Seems it's only there for the car chases that aren't particularly good imo.,3/13/18 20:43,1,37,0.1358893
22,Games,/r/Games/comments/8491yu/what_are_some_open_world_games_that_would/,Well it wasn't going to be a open world. It was by inlarge a last minute decision ,3/13/18 20:46,1,37,0.19996819
23,Games,/r/Games/comments/8491yu/what_are_some_open_world_games_that_would/,"Such a wasted effort too. As someone who has lived in LA for over a decade, I was totally looking forward to messing around in a 1940's version and of it. However, once the initial ""wow-factor"" wore off, there was nothing else to do and no activities. Considering that most of the game involved text-based gameplay in an assorted mixture of interior locales, it seems silly that they felt the need to build massive area to explore.",3/13/18 20:58,1,37,0.19522241
24,Games,/r/Games/comments/8491yu/what_are_some_open_world_games_that_would/,"I think as far as open worlds go, Andromeda wasn't terrible, but it really didn't serve the characters and storytelling as well as the previous games setup did. ",3/13/18 20:30,1,37,0.044180304
